NYC’s Wonton Queen Maxi Lau Blesses Flushing (Again) With Her Second Noodle Shop,https://hellgatenyc.com/best-wontons-nyc-maxis-noodle-2-flushing-review,59-20 Main Street,Maxi Lau (https://example.com/maxi-lau),"59-20+Main+Street,+NYC",Maxi Lau,40.7433137,-73.8259106,https://example.com/maxi-lau,,,,"Ever since she could remember, Maxi Lau always wanted to open a restaurant. She—and, subsequently, we —have her mom to thank for that. ""I started this whole restaurant business because of my mother,"" Lau told Hell Gate. ""We lived in Hong Kong until I was nine, moving to Long Island in 1997, and it was always her dream to open up a wonton noodle shop."" To that end, Lau's mom traveled to Toronto to learn the art of wontons from family friends who own a string of renowned noodle shops in Canada as well as in Hong Kong. After returning to New York, however, she was diagnosed with breast cancer before she could see her dream come to fruition. ""When my mother passed away, those same family friends reached out and offered to teach me,"" Lau said. ""This was in 2017. It changed my life."" Lau started with popups, taking over her aunt's Hong Kong-style coffee shop, Kissena Cafe, in the evenings. Then an unexpected Pete Wells rave in the New York Times about her wontons fast-tracked the whole operation, and in September of 2019, she opened her first Maxi's Noodle, snagging a prime location on 38th Avenue in Flushing. Lau really wanted to expand into Manhattan for Maxi's Noodle 2, and said she was ""so close"" to signing for a place on Elizabeth Street. Instead, it's Flushing that gets more Maxi for now, with this spanking new corner spot on Main Street, near Flushing Meadows Corona Park. For Lau, opening her second Maxi's so close to the first has its advantages. All of her team lives in Flushing, she said, so it makes staffing a lot easier. And the kitchen at the new spot is huge, so she can wrap all of her wontons for both restaurants here, and free up some much-needed space at her original location. So why all the fuss about a second noodle joint in Flushing, you say? Aren't there already plenty of places to get wontons around here? Yes—but none like Lau's. First off, the Maxi's wontons are enormous—""Americanized and super-sized"" is how Lau put it—almost three times as big as you'd find at, say, Chinatown's Wu's Wonton King. Secondly, they're made almost entirely of shrimp. ""A lot of wontons have mostly pork and maybe like one shrimp inside,"" she said. ""Mine are 90 percent shrimp and 10 percent pork."" Six wontons in soup, $10.75. (Scott Lynch / Hell Gate) More important, the wontons at Maxi's are superb, the wrinkled wrapper nice and thin but still plenty sturdy, the stuffing delivering that sweet snap of perfectly cooked crustacean. Spoon on some of that chili oil and they're probably the best in the city. You can get your wontons swimming in a big bowl of lovely broth, which you will definitely want to drink down at the end, or plopped atop your choice of noodle (duck egg, flat rice, vermicelli, or udon) with a cup of broth served on the side. There's no wrong answer here, so just trust your cravings. There are seven different topping options as well, including some excellent beef tendon; extremely large fish balls; and the sweet pork and mushroom sauce, zha jiang. Beef stew, made with an uncle's secret recipe, and fried fish skin are also available. There's no booze, but the iced Hong Kong milk tea hits the spot. Duck egg noodles with three toppings: dace fish balls, zha jiang, and beef tendon, $15.75. (Scott Lynch / Hell Gate) ""We literally built our business by word of mouth,"" said Lau. ""I don't do any advertising, and only recently did any social media stuff. I don't have time, I'm running the kitchen! I'm running the whole store! But people have been so supportive in Flushing."" It's easy to see why. Maxi's Noodle 2 is located at 59-20 Main Street, on the corner of 60th Avenue, and is currently open from 10 a.m. to 7 p.m. daily. (917-508-3288) (Scott Lynch / Hell Gate) Already a user? Log in Thanks for reading! Give us your email address to keep reading two more articles for free Email Register See all subscription options",,,,
Sen Saigon Is Throwing a Vegan Vietnamese Party on East Broadway,https://hellgatenyc.com/sen-saigon-vegan-vietnamese-east-broadway-chinatown-nyc,150 E Broadway,Sen Saigon (https://www.instagram.com/sensaigon.nyc),"150+E+Broadway,+NYC",Sen Saigon,40.7143761480397,-73.990988107691,https://www.instagram.com/sensaigon.nyc,,,,"The origin story of Sen Saigon, a vegan Vietnamese spot that opened last weekend on East Broadway, is an unusually dramatic (and bloody!) one, at least as far as counter-service restaurants go. The chef here is An Nguyen Hawks, who was born and raised in and around Ho Chi Minh City before moving to New York City in 2014. She, her husband and business partner Erik Hawks, and their young son lived in Greenpoint before they decamped to Sunnyside. The Hawkses were lifelong omnivores until about four years ago, when, as Hawks told Hell Gate, their kid had a mishap. ""He got a big cut on his finger because he slammed it in the door,"" she recalled. ""There was a lot of blood and suffering going on. I'm not religious, but I told myself, if my son heals well, I won't eat meat for a month. He was fine, I kept my promise, and I never went back to eating meat."" Hawks discovered that she loved being vegetarian, and she became a vegan soon after. And she realized that it was almost impossible to find good plant-based Vietnamese food in the city. So she taught herself how to make her favorite dishes, sans meat—and Sen Saigon was born. ""I didn't miss the meat, but I did miss the traditional foods of home,"" she said. ""So I learned how to recreate them in vegan versions, which brought me a lot of joy and fun."" Judging how packed and festive Sen Saigon was on its soft-opening day last Saturday, plenty of other people want to get in on the party too. Even with a limited menu and days of prep, the team sold out of stuff several times, and had to scramble to keep making more. Bánh mì with tofu, mushrooms, and lemongrass, $11.75. (Scott Lynch / Hell Gate) Hawks doesn't use commercially produced ""mock meat"" at Sen Saigon, so the bánh mì here, for example, relies on well-seasoned tofu and a funky mushroom and nut paté of her own creation to bring the sandwich's familiar flavors forward. The lemongrass helps in that regard as well. The best thing we ate was the bún huế. The soup's vegan broth has a rich, lively presence, and the ample ingredients—tangles of spaghetti-like noodles, a slab of fried tofu, some greens and cabbage and carrots, plus Hawks's own vegan Vietnamese ham—give the dish plenty of heft. Bún huế, $18.25. (Scott Lynch / Hell Gate) The menu will expand in the coming weeks, but for now, your starter options include a crunchy lotus root salad, a pair of terrific mushroom and lemongrass summer rolls, and three takes on crisp-fried spring rolls, which we had stuffed with corn. There's no booze at Sen Saigon, but the housemade iced bean tea and vegan Thai coffee both hit the spot. And for dessert, there's Hawks's vegan flan, which doesn't quite pull off the eggy richness of my favorite flans around town, but does offer a bit of that burnt-caramel bite. The space is crammed nearly to chaos with tables and people waiting on line to order at the counter in the back, though the mirrors along one wall, flanked by shutters to create the illusion of windows, help alleviate any claustrophobia. Besides, there's too much of Hawks's ""fun and joy"" in the air here for anyone to feel stressed. (Scott Lynch / Hell Gate) ""My main purpose of this is, I just want to share the food with everyone. Everyone is welcome,"" she said. ""I really hope people give it a try. I was so nervous when I opened the doors [on opening day] whether we'd have customers, and the moment we opened people came in. It's been wonderful."" Sen Saigon is located at 150 East Broadway, just west of Rutgers Street, and is currently open on Friday through Sunday, from noon to 7 p.m. Expect more days in the near future, and the menu will expand as well. (Scott Lynch / Hell Gate) Already a user? Log in Thanks for reading! Give us your email address to keep reading two more articles for free Email Register See all subscription options",,,,
Make Your Way to Flatbush’s Yaadman Thing for NYC’s Best Curry Goat,https://hellgatenyc.com/incredible-homestyle-jamaican-food-yaadman-thing-flatbush-review,3901 Church Avenue,Yaadman Thing (https://www.instagram.com/yaadman.thing/?hl=en),"3901+Church+Avenue,+NYC",Yaadman Thing,40.6521242,-73.9408156,https://www.instagram.com/yaadman.thing/?hl=en,,,,"Jhenell Nelson was born and raised in Jamaica, in the parish of Portland. When she moved to Brooklyn four years ago, she brought with her a partner—namely, her husband Kemar—and everything her grandmother ever taught her back home about cooking: an array of Jamaican classics like jerk chicken, curry goat, and callaloo. The couple spent their first few years manning sidewalk grills at various Church Avenue corners (Church and Bedford, Church and Rogers, Church and Albany), and built up enough of a local following that at the end of 2021, the Nelsons opened their first ever restaurant, Yaadman Thing, on Church and 39th Street. Outside of Yaadman Thing. (Scott Lynch / Hell Gate) ""If you're from Jamaica, and you're real about it, you're called a yaadman,"" Jhenell told Hell Gate. ""And since everything in here is authentic, we call it a Yaadman Thing."" Yaadman Thing is a modest space. ""Dining in,"" for instance, means grabbing one of only two stools at the counter in the front window; the side windows were bricked over years ago; and, other than a fresh paint job, there's little to distinguish it aesthetically from any of the dozens of other jerk joints in this part of town. Ah, but last week, I got a tip about Yaadman from my boss's mom at my other job, who told me that the jerk here is the best in Brooklyn. Sold! One 5 train ride from the city later (there's a Citi Bike dock right on Church and 38th too, which I used to get home to Bushwick), and I was scarfing down an enormous serving of fatty, juicy, heavily seasoned, wonderfully saucy, hacked-up pig. Medium-sized jerk pork dinner with rice and peas and cabbage, $13. (Scott Lynch / Hell Gate) Seriously, this is some excellent jerk. There's also jerk chicken here, of course, as well as jerk ribs, jerk shrimp, and—for you $45 Dinner ballers out there—jerk lobster. Jhenell said that they're in the process of producing a line of Yaadman Thing jerk sauce, and I would have definitely brought a bottle home if they'd been ready. The jerk combo meal comes in three sizes—my $13 ""medium"" weighed like five pounds—and comes with white rice or rice and peas, plus a side dish like coleslaw, macaroni salad, or steamed cabbage. It's all great stuff, and super filling. Even better, though, is Jhenell's curry goat, my go-to at Jamaican spots and, here at Yaadman, maybe the best I've ever had. The meat was tender and funky, the sauce delivered a good amount of fire, and it made a perfect companion for my side of gooey, crusty mac and cheese. Small-sized portion of curry goat, $11, with mac and cheese, $4. (Scott Lynch / Hell Gate) With these portions, you don't need any extras, but the festivals, a deep-fried sweet dumpling, are so good—freshly fried, slightly crisp, and just the right amount of sweet—that it's a pleasure to overindulge. My Yaadman list for my next visit includes oxtail, doubles, whatever soup Jhenell's got going on (apparently she does a goat's head on the weekend), and maybe the roast conch. Festivals, three for $2. (Scott Lynch / Hell Gate) It all vibes very homemade, like if you were invited to a barbecue or something at the Nelsons' house. ""This is my kitchen,"" Jhenell said. ""We use natural herbs and spices, we cook on the grill, and we keep it Jamaican."" In other words, it's absolutely a Yaadman Thing. Yaadman Thing is located at 3901 Church Avenue, at the corner of 39th Street, and is open Monday through Thursday from 7 a.m. (have some ackee and saltfish for breakfast!) to 9 p.m., on Friday and Saturday to 10 p.m., and on Sunday from 8 a.m to 7 p.m. (347-365-3315) Co-owner and chef Jhenell Nelson helps a customer. (Scott Lynch / Hell Gate) Already a user? Log in Thanks for reading! Give us your email address to keep reading two more articles for free Email Register See all subscription options",,,,
"A Love Letter to Doaba Deli, a Homey Community Hub",https://hellgatenyc.com/a-love-letter-to-doaba-deli-a-homey-community-hub,945 Columbus Avenue,Punjabi Deli (https://gothamist.com/food/checking-recently-reopened-punjabi-east-village-),"945+Columbus+Avenue,+NYC",Punjabi Deli,40.7994092,-73.9624171,https://gothamist.com/food/checking-recently-reopened-punjabi-east-village-,,,,"In a perfect world, there would be hundreds of places like Doaba Deli all over the city. I'm talking simple, welcoming spots where you could stop in for a plate of cheap, perfectly good food, something warm to drink, and a bit of fellowship—no drama, no frills, and no-questions-asked access to a reasonably clean bathroom. Actually, in a perfect perfect world, such places would be funded and operated in a loving and non-corrupt manner by the City itself, as a necessary public service. But until that day comes, at least we have people like Inderjit Singh, who opened Doaba Deli almost 15 years ago and has been feeding people from all walks of life—though Columbia students and cabbies seem to make up the bulk of his clientele—ever since. Your menu is whatever you see at the steam table. (Scott Lynch / Hell Gate) Does 15 years sound like not that long ago? Maybe, but the place feels like it's been here much longer than that. Other than the freshly painted, alarmingly green walls, Doaba Deli has a very lived-in vibe, with battered tables, faded signage, and a single, smeary menu whose prices have been updated by hand over the years. Thankfully, those prices have not gone up by much. The standard order here is a choice of three (usually vegetarian) dishes served with either rice or roti. It used to be $7, and now it's $10. Samosas are $1.50 extra. And really, ignore the menu. Whatever's set out in the steam table is what's available. Three dishes (dal, spinach, and squash) and rice, $10. (Scott Lynch / Hell Gate) Three dishes (cabbage patta gobi, chickpeas, red bean radima) and roti, $10; the samosas are $1.50 each. (Scott Lynch / Hell Gate) When we went on a recent Saturday night, that included some decent yellow daal, a good spinach and mustard saag, a sweet squash dish that we liked a lot, and some chunky cabbage patta gobi. The white rice and freshly warmed roti were both fine, and the samosas were great. Several of our fellow patrons popped in just to wolf a pair of these latter savory pastries with a cup of chai. Everything can be given a zippy boost from the pickled achaar that sits at each table, which I suggest you spoon on with abandon. Enjoying the fare, handmade or not. (Scott Lynch / Hell Gate) Despite signs boasting that Doaba serves ""America's finest handmade paratha,"" and, additionally, that this is the ""paratha capital of New York City,"" that particular style of flatbread was unavailable when we went. In fact, evidence—via unconcealed storage areas in the clearly visible kitchen—suggests that these days Doaba Deli is mostly heating up (or, in the case of our mango lassi, pouring out) institutional fare from bulk-sized containers rather than making stuff from scratch. That's not what I remember from years ago, but also, it's fine? Food-wise, Punjabi Deli in the East Village remains the gold standard among the city's South Asian steam table spots, but Doaba gets the job done too, and provides an important resource in a neighborhood that often treats the workers it relies upon (for food delivery , or ride share services) with disdain. Doaba Deli is located at 945 Columbus Avenue, between 106th and 107th Streets, and is currently open from 10:00 a.m. to midnight daily. Already a user? Log in Thanks for reading! Give us your email address to keep reading two more articles for free Email Register See all subscription options",,,,
This East Village Block Now Stars Both Lebanese Fried Chicken And Pakistani Paratha Rolls,https://hellgatenyc.com/hen-house-and-kolachi-on-one-east-village-block,130 First Avenue,Kolachi (),"130+First+Avenue,+NYC",Kolachi,40.7275350469347,-73.9852568664757,https://hellgatenyc.com/hen-house-and-kolachi-on-one-east-village-block/,,,,"Hen House NYC, which chef Antony Nassif opened about two months ago on First Avenue in the East Village, seems to have a half dozen signature dishes. The excellent ""late night chicken sandwich,"" for example (which, don't worry, is available all day), is a fiery beast of meal, a squishy bun unable to contain the pile of impossibly juicy, crackling-fried thigh meat, which is slathered in garlic sauce and Nassif's housemade piri piri, then topped with fresh parsley and both pickled red cabbage and just regular pickles for a double-hit of acid. It's also halal. And has the name of the place branded on its bun. And it's delicious. A Hen House must. But maybe Nassif's authentic Lebanese and Egyptian dishes, conjured from childhood memories and his grandmother's recipes, should be considered signature Hen House fare? Nassif calls the Molokheya here ""my most favorite thing on the planet,"" and after wolfing a bowl the other day I can see where he's coming from--this thick, lemony, parsley-rich Egyptian chicken soup, spooned over rice and blanketed in pickled onions, is a deeply satisfying cold-weather dish. ""I grew up eating this at my grandmother's house,"" he told Hell Gate. ""It's super nostalgic for me."" Molokheya, $13. (Scott Lynch / Hell Gate) Other Nassif nostalgia bombs include the ""childhood crispy kafta rice,"" which I hear is amazing, and, really, all of the pitas, which he stuffs with abandon and rolls up tight. ""These are the shawarmas that I grew up eating,"" he said. ""Especially when I lived in Beirut."" The pomegranate molasses is important here, but he was also raised in Montreal, so there's a ""fully loaded"" (e.g., with French fries) versions of everything too. You can get these with chicken, lamb (my choice, and terrific), soujouk, or made vegan. (Scott Lynch / Hell Gate) Nassif launched the Hen House concept last summer at Smorgasburg, (you may also know his name from the original Mile End in Boerum Hill or, more recently, at The York bar up on Avenue B), but this is first solo restaurant. So far, thanks in part for some high-profile social media love , he's been killing it. ""It's been great,"" he said. ""And midnight to 2:00 a.m. has been insane. When spring comes we'll stay open until 3:00 a.m. In this neighborhood, at night, people are out ."" Hen House NYC is located at 120 First Avenue, between St. Marks Place and Seventh Street, and is currently open from Tuesday through Thursday from 12:00 noon to 10:00 p.m., on Friday and Saturday from noon to 2:00 a.m., and on Sunday from noon to 8:00 p.m. (Scott Lynch / Hell Gate) It's easier to figure out the signature dishes at Kolachi, which opened last November just a few doors up from Hen House, because there's literally only three things on the menu. Operated by Saif Qazi and Kiran Lutfeali, partners in business and life as the saying goes, Kolachi specializes in the sort of paratha rolls that, according to Qazi, are everywhere in his native Karachi--""it's like our cheeseburgers, or slices of pizza"" he said--but, to the couple's dismay, were impossible to find here in New York City. Chicken and beef paratha rolls, $6.50 each. (Scott Lynch / Hell Gate) The Kolachi rolls are about the size of a big spliff or fat cigar, and contain a single skewers-worth of flame-grilled beef or chicken, enough onion to get your attention, and, key ingredient, a ton of tangy, funky mint yogurt chutney sauce. Maybe I liked the chicken one better? It had a little more kick than the beef. Both, though, really hit the spot. You definitely want to get the fries here, too, which are well-seasoned and just the right amount of fluffy. They're called ""diesel fries,"" but not because they use diesel oil to cook them. Qazi explains: ""In Karachi kids sell fries from carts, and they have these home electric fryers which they power with diesel generators. So when you walk up to the cart you smell the diesel immediately. So folks just started calling them diesel fries."" Diesel fries with maple syrup, $4.50. (Scott Lynch / Hell Gate) Major plot twist, every order of fries is served with a little crock of maple syrup for dipping, a condiment I don't think I've ever seen handed over in this context without explanation. ""It's a little bit inspired by Karachi ketchup,"" Qafi said. ""These kids sell this ketchup that no New Yorker would ever call ketchup. It is sweet and it is bright red. But also, my wife [Lutfeali] always likes to mix sweet with savory, so she thinks it's good."" And she's correct. It rules. Kolachi is located at 130 First Avenue, between St. Marks Place and Seventh Street, and is currently open on Monday through Friday from 4:00 p.m. to 12:00 midnight, and on Saturday and Sunday from 11:00 a.m. to midnight. Already a user? Log in Thanks for reading! Give us your email address to keep reading two more articles for free Email Register See all subscription options",,,,
