Headline,Article Link,Address,Restaurant Names and Links,Google Maps Address,Restaurant Name,Latitude,Longitude,Link,Unnamed: 10,Unnamed: 11,Unnamed: 12,Article Body,Excerpt,Author,Date,Raw Address
$20 Dinner: New “Urban Hawker” Market Brings The Flavors Of Singapore To Midtown,https://hellgatenyc.com/20-dollar-dinner-urban-hawker-market,135 West 50th Street,"Urban Hawker (https://www.urbanhawker.com/), Ashes Burnnit (https://www.instagram.com/ashesburnnitnyc/), Lady Wong (https://ladywong.com/)","135+West+50th+Street,+NYC",Urban Hawker,40.7608856,-73.9825548,https://www.urbanhawker.com/,,,,"It was almost ten years ago that we first started hearing about KF Seetoh's Urban Hawker , the brand new, instantly popular food hall in Midtown that makes Singapore's legendary street food the star. Back then, in 2013, Anthony Bourdain was a driving force in the project, and the basic idea was to open a massive ""dining experience"" over at Pier 57, bringing street-food vendors from all over the world to Chelsea. Plans changed a bit. Bourdain died in 2018, of course, and Google, along with the James Beard Foundation, took over Pier 57 . There's now a park on the roof there, a City Winery up front, and, yes, coming semi-soon, a food hall being built within , featuring a long list of NYC-based vendors that is, for now, a closely-kept secret. But Seetoh, who's also the founder of the World Street Food Congress , didn't give up his dream, and last week, partnering with the folks at Urbanspace, his Urban Hawker had its grand opening on West 50th Street, hard by Radio City, Rock Center, and the office towers of Sixth Avenue, for maximum exposure to both area office workers (who are, indeed, back , at least on Tuesday through Thursday) and the upcoming influx of holiday-season tourists. The main entrance on West 50th Street. (Scott Lynch) But don't let that dissuade you, if you’re neither a vest-bro nor a visitor to our fair city from Holland. Urban Hawker is a blast, with a convivial, even rowdy vibe, ample seating and standing counters for eating throughout, a full bar over by the 51st Street entrance, and 17 different vendors eager to feed you. Eleven of the vendors come straight from the streets of Singapore, and all of them reflect that island nation's incredibly diverse food culture, with its strong hits of Malaysian, Chinese, Indian, Filipino, Peranakan, and Indonesian cuisines. ""We never really thought something like this would ever happen,"" Urban Hawker GM Larry Reutens told Hell Gate. ""I've lived here for almost 20 years and to see these hawkers cooking in New York City is unreal. To be with some of these chefs or hawkers or whatever you want to call them, these guys who cook noodles, the same noodle dish, for 12, 15, 16 hours a day in Singapore, standing in front of their wok, to hang out with them in NYC... it just blows my mind. It's like: oh my god, that's the actual guy!"" Almost every dish at every booth is priced comfortably under $20, and the portions, in general, are entree-sized. The obvious move, though, is to come with a crew, get a bunch of different things, and share it all. Here are five suggestions to get you started—we've eaten dinner at Urban Hawker twice already, and also sampled with abandon at a preview party—but know that this is only a taste of what's being hawked here. Original White Beehon at White Restaurant ($15.95) White is one of the many Singaporean imports, and apparently the OG chef here, Mr. Tay King Huak, invented this dish . It's incredible! Instantly soothing and deeply satisfying, it features a mess of slippery rice vermicelli (the ""beehoon"") all sodden in a rich, complex broth that's been burbling away for at least eight hours in the kitchen, and topped with four fat shrimp, a few thick tubes of nubby fish, and some bok choy for a bit of brightness. You can also get it with slices of pork or chicken cutlets, or vegetables and wild mushrooms, or even served Szechuan style. Make this a priority. Classic Poached Chicken Rice Set at Hainan Jones ($17) The early winner for Urban Hawker's longest line award goes to Hainan Jones, a collaboration between Seetoh's company Makansutra and the rakishly be-hatted Raymond Kiang, whose father Joon Toh Kiang put this dish on the map back in the 1970s at Singapore's luxe Mandarin Hotel. Definitely get the poached chicken version—it's always remarkable how much flavor and juice resides in such a plain-looking piece of bird—and, if you can persuade the friendly counter person, an extra jolt of chili sauce. Don't be afraid to pick up your cup of broth and drink deeply between bites. Pork Adobo at Tradisyon ($16) The Tradisyon crew only had to travel from Hell's Kitchen to open their Urban Hawker stall, but their Filipino comfort food should not be overlooked. The Vegan Pancit (rice noodles), Crispy Pata (pork knuckles), and Tinapa Mackerel with pineapple are all solid choices, but we can't resist that bowl of Pork Adobo, starring big, three-bite hunks of jiggly pig belly in a tart soy vinegar sauce, plus a whole hard-boiled egg, and crispy shallots and garlic strewn over the top. My cardiologist would be horrified. Singa Roti John at Ashes Burnnit ($11.99) Lee Syafiq has a hit on his hands with Ashes Burnnit in Singapore—there are four of these halal burger stands on "" the little red dot island ,"" and he won Outstanding Hawker at the World Gourmet Awards last May. Here at Urban Hawker, Syafiq is slinging satay chicken burgers, smashed-style beef patties, fried fish burgers, and the crazy good Singa Roti John, a Singapore-style omelet sandwich piled high with curry ground beef, multiple cheeses, coriander, and a few squirts of a gloppy orange sauce, all set within a super soft hero roll. Do you have a hangover? Not anymore you don't. Mee Goreng Mamak at Mamak's Corner ($12.50) This literally-in-the-corner stall from Shukor Tahir and Rajan Belani has all sort of Singapore Indian delights, from Chapati flat bread with lamb curry to thick Murtabak pancakes loaded with beef, egg, and chicken curry, and a bunch of Biryanis, either lamb, chicken, fish, or vegetable. We zeroed in on the almost neon-red Mee Goreng Mamak however, a platter of Indian-style egg noodles wok-fried with tomato sambal sauce and tossed with minced meat. Ask them to please make it spicy though. We've now had it both fiery and mild, and the former is definitely better. Like I said, that's just a small sampling of what you'll find here. Whenever Wok & Staple opens, an offshoot of Singapore's famous Dragon Phoenix restaurant, get their Sambal Chili Crab. The BBQ Stingray Fried Rice ($17) at Mr. Fried Rice is extremely Singaporean, the lovely Lamb Satay ($16.50) at Padi comes with an excellent peanut sauce, and Daisy's Dream Kitchen features a lively Nyonya Nasi Lemak ($14.95). And if you're feeling flush, splurge on one or several desserts from Lady Wong . The Pandan Panna Cotta ($6.50) is especially sublime. Raymond Kiang at Hainan Jones (Scott Lynch) Some stalls at Urban Hawker still aren't up and running, and most close at some point during the afternoon, for an hour or three, to give the staff a break and retool for dinner. The place has been slammed at lunch mid-week, apparently, and Reutens told us that the nighttime crowd likes to linger and feast, so plan accordingly. ""We get customers who are just overwhelmed by the experience,"" said Reutens. ""Because even though it's New York, and even though it doesn't necessarily look like a hawker center back in Singapore, it feels like it, and it smells like it, and we're all kind of experiencing this flood of feelings, of being with friends and having the same thing we had at home, and it's truly overwhelming."" Urban Hawker is located at 135 West 50th Street, between Sixth and Seventh Avenues (there's also an entrance on 51st), and is currently open for breakfast, lunch, drinks, and dinner. The hours for each individual stall vary. Already a user? Log in Thanks for reading! Give us your email address to keep reading two more articles for free Email Register See all subscription options",,,,
$20 Dinner: Filipino Favorite Dollar Hits Brings the Skewer Party to Woodside,https://hellgatenyc.com/20-dinner-filipino-favorite-dollar-hits-brings-the-skewer-party-to-woodside,39-04 64th Street,Dollar Hits (https://www.instagram.com/dollarhits/?hl=en),"39-04+64th+Street,+NYC",Dollar Hits,40.7463337,-73.9000145,https://www.instagram.com/dollarhits/?hl=en,,,,"New York is just getting all of the polished fruits of Los Angeles street experiments now. Last week, we feasted on Dave's Hot Chicken , a California chain that started in an LA parking lot and opened its first East Coast outpost last summer near Columbus Circle. And this week, we got on the 7 train to Woodside for what turned out to be a gluttonous array of grilled meats and other delights at the wildly popular LA Filipino skewer spot Dollar Hits, which Elvira Chan initially brought to life as a food stand in LA in 2013. In New York City, Dollar Hits now commands a corner storefront in Queens. Controlled chaos. (Scott Lynch / Hell Gate) At the restaurant's New York location, you definitely need to be comfortable with a bit of chaos to enjoy your meal. After some retooling since opening day, Dollar Hits now works like this: The skewers start coming out at around 3:30 in the afternoon and are greeted by a crowd hovering in some semblance of a line waiting for the signal to start self-serving, and then a kind of free-for-all begins, all while food is still being brought up from the back. Some of the items on the skewers are self-evident, others less so (Are those...chicken heads? Hell yeah!), but who cares! Everything is only $1.50 each—up from the eponymous ""dollar"" of a decade ago, but still cheap as hell—so just grab whatever strikes your fancy. Our favorites included the beef intestine, the cubes of pork blood, the chicken skin, the fat sweet sausage, and the battered quail eggs. The skinny fried lumpia sticks are also really good—get at least one of those. The Hell Gate skewer party, $24. (Scott Lynch / Hell Gate) Oh wait, do you want some of the lechon on the trays in the back? Yes, you do, because it's delicious, with crackling pig skin and squishy, fatty meat, but you'll have to figure out how to get one of the extremely busy workers to stop for a second and hack up a paper boat's worth for you. And that huge tray of skinny stir-fried noodles back there, is that pancit, aka Filipino chow mein? Yes it is! You definitely want someone to fill up a pint container of that. A pint of pancit, around four bucks. (Scott Lynch / Hell Gate) Freshly hacked lechon, or roasted suckling pig, sold per pound. This was about $8. (Scott Lynch / Hell Gate) Once you've assembled your too-large meal, bring it around to the cluttered counter by the register where someone, maybe even Chan herself until she heads back home to LA, will total it up for you. The skewers are then whisked off to the kitchen for grilling (outdoor self-grilling stations are no longer an option, thanks to the FDNY), so find a table, ladle yourself cups of vinegary sawsawan sauce, and listen for your number. Dollar Hits founder and co-owner Elvira Chan, who runs the business with her sisters Josephine Estoesta and Nelita Deguia. (Scott Lynch / Hell Gate) The sidewalk seating situation is utilitarian but fine, and what the indoor dining room lacks in decor—the look here is pretty much ""surplus restaurant furniture in a stock room""—it makes up for in customer enthusiasm. Chan told Hell Gate that the scene really gets lit when the sun goes down. ""I am so happy to serve New Yorkers,"" she said. ""Especially at night time. They are singing, they are dancing, oh my god, everybody having fun."" During the day, Dollar Hits functions as a canteen, with a turo turo—""point point"" in Tagalog—steam table, shelves of Filipino snacks and chips, and pre-packaged treats like a bright green, jello-y buko pandan. The vibe. (Scott Lynch / Hell Gate) Woodside's Filipino community has come out in force for Dollar Hits, Chan's third restaurant overall and first in NYC. ""Thank you to all New Yorkers for giving me a warm welcome,"" she said. Hell Gate total for two (though we could have fed three), including tax but not including tip or beverages: $38.48 Dollar Hits is located at 39-04 64th Street, at the corner of 39th Avenue, and is currently open Tuesday through Sunday from 9:00 a.m. to 3:30 p.m. for breakfast and the canteen, and from 4:00 p.m. to 11:00 p.m. for skewers. It's closed on Mondays. (Scott Lynch / Hell Gate) Already a user? Log in Thanks for reading! Give us your email address to keep reading two more articles for free Email Register See all subscription options",,,,
$20 Dinner: Dave’s Hot Chicken Hits Midtown With Some Seriously Good Bird,https://hellgatenyc.com/20-dinner-daves-hot-chicken-seriously-good-bird,944 Eighth Avenue,Dave's Hot Chicken (https://www.daveshotchicken.com),"944+Eighth+Avenue,+NYC",Dave's Hot Chicken,40.7657643,-73.9831962,https://www.daveshotchicken.com,,,,"Dave's Hot Chicken, which opened in August on a cluttered stretch of Eighth Avenue right below Columbus Circle, is technically a fast-casual, rather than a fast-food, restaurant, meaning that your meal is made to order, rather than pre-prepared, wrapped up, and ready-to-go under some heat lamps. Which is good news, obviously, for everyone who enjoys a freshly made—or, at least, freshly assembled—meal. You should know, though, that the vibe here at Dave's is pure fast-food. The tables turn quickly, the teenagers talk loudly, the logos are everywhere, the surfaces are extremely wipeable, the lighting is aggressively non-atmospheric. And yet Dave's Hot Chicken also seems to be something of a destination restaurant. Literally everyone we spoke with during our $20 Dinner last week had taken at least one subway to get here, coming down from the Bronx, or Morningside Heights, or City College. Apparently there's also a line-out-the-door situation most nights, hence the crowd-control stanchions on the sidewalk. As Yoobin Chu, a young man from the Bronx, told Hell Gate, ""This was my first time. I just wanted to see if it was worth the hype. My stomach is feeling the hot, but it tasted great."" Fast food vibes (Scott Lynch / Hell Gate) Let's step back for some Dave's Hot Chicken history, which among other things involves a certain Canadian rapper named Drizzy. The ""Dave"" here is Dave Kopushyan, a chef with high-end training who, along with his best friends Arman Oganesyan, and Tommy and Gary Rubenyan, started slinging chicken from a $900 fryer in an East Hollywood parking lot next to his parent's flower shop in 2017. The spot blew up (thanks in part to an Eater LA rave ), the crew opened a few brick-and-mortars around Los Angeles, and just when the hype seemed like it couldn't get any more out of hand, the aforementioned Drake stopped by, loved the chicken, and signed on as a major investor. Boom! There are now 74 Dave's Hot Chicken restaurants in existence, including this chaotic little number in Midtown, the first one anywhere on the East Coast. Two sliders with cheese done extra hot with fries ($16.37), two tenders done medium with fries ($12.99) (Scott Lynch / Hell Gate) So why should you care about any of this? I admit I was skeptical going in. An LA import on a depressing block in Midtown? Call me when those cowards at In-N-Out land here, so I can trash their garbage fries. But Dave's serves up some truly first-rate fried bird, served either as “tenders” set atop slices of white bread, or in “slider” format with kale slaw and optional melted cheese. The chicken is all white meat (and halal!) but it’s surprisingly juicy, and Dave’s proprietary dry rub, cranked up spicy as a motherfucker if you want, adds a nice bit of crunch. A word about the heat range. You can choose from no spice (the only level that doesn't start with a hot wet rub) to mild, medium, hot, extra hot, and reaper, the latter of which comes with a waiver absolving Dave’s from any physical and/or emotional pain you might experience while eating it. Hell Gate went with medium and extra hot, and the consensus here is that the former provides plenty of fire and flavor, no need to be a hero by ramping it up. You can order your chicken solo, but the basic (and only) combo comes with well-seasoned crinkle cut fries, which are decent when dunked in Dave’s orange sauce. The only other side dish is some creamy mac and cheese. Real players (us, halfway through our first ever meal here) know to pull apart the chicken tender and stir it into the creamy crock of pasta. Really, you could almost make a meal right there. This is how real players do it (Scott Lynch / Hell Gate) There are small reasons for dismay at Dave's. Every order, even if you tell them you're dining in, is packed up to go, with single-use containers and utensils stuffed into a plastic bag that you carry six feet to your table and then send off to join some patch in the ocean for the next three thousand years. The potato rolls on those sliders are Martin’s, whose executive chair, Jim Martin, amplifies his terrible politics by giving large sums of money to a far-right candidate for governor in Pennsylvania. Jamal Hoque, the GM, operations director, and co-owner of Dave's, told Hell Gate, “The buns don’t talk.” Yeah, OK. And the corny “graffiti” walls were done by an outfit called Splatter House, which Hoque called “a part of the brand” that does murals at every new Dave’s across the country. It’s a lazy way to try and establish cred. (Scott Lynch / Hell Gate) Hell Gate total for two, including tax but excluding tip and the vanilla milkshake we would have ordered if the machine was up and running: $35.77 Dave's Hot Chicken is located at 944 Eighth Avenue, between 55th and 56th Streets, and is currently open from 10:30 a.m. to 11:00 p.m. daily (332-999-1825) Already a user? Log in Thanks for reading! Give us your email address to keep reading two more articles for free Email Register See all subscription options",,,,
"$20 Dinner: Terrific Tacos, Tortas, and Gringas at Bushwick’s Plaza Ortega",https://hellgatenyc.com/20-dinner-terrific-tacos-tortas-and-gringas-at-bushwicks-plaza-ortega,22 Plaza Ortega is located at 140 Stanhope Street,Plaza Ortega (https://www.instagram.com/plazaortegany/?hl=en),"22+Plaza+Ortega+is+located+at+140+Stanhope+Street,+NYC",Plaza Ortega,40.6982505,-73.9226004,https://www.instagram.com/plazaortegany/?hl=en,,,,"You would be forgiven if you spent the last couple of years biking by Plaza Ortega without giving it a second thought. One, because Myrtle under the elevated line can be pretty hairy, with its ripped-up road and zero clearance for cyclists—take the lane over here for sure—and deserves your full attention. But also, you're in Bushwick, where there are tons of good taquerias lurking in the back of bodegas (and, to be honest, a few pretty lousy ones as well), so if you live around here you probably already have a favorite spot or two. (Scott Lynch / Hell Gate) From the outside, Plaza Ortega doesn't exactly scream hidden gem, what with the blade flags and giant food stickers sitting at the base of one of those new ""luxury"" residential buildings that have sprouted up all over this area in the past decade or so . Ah, but pull over for a moment and consider this: there's a surprising amount of seating here, both inside and outside, so it functions as an actual restaurant in addition to being a well-stocked market. And, as will become clear as soon as you tuck into your tray of tacos and tortas and whatever else you ordered, Plaza Ortega serves some really terrific food. The market is meant to evoke the welcoming vibe of Puebla. (Scott Lynch / Hell Gate) The owner is Jose Ortega, who grew up in Puebla, about two hours southeast of Mexico City, then lived in Queens for about two decades before moving to Long Island five years ago. Ortega has cooked for a living his entire New York life, though as he told Hell Gate after we feasted the other day, this is the first time he's ever served his food at a Mexican restaurant. His previous gig, before COVID put an abrupt end to things? ""I was working at a place in Times Square for 12 years, called Tonic,"" Ortega said. ""A sports bar right across the street from the M&M Store."" Hell yeah? Anyway, if he can keep up the quality here on Myrtle, those days of feeding the tourist hordes and drunk office bros are definitely over. Fish taco ($3.50), taco al pastor ($3) (Scott Lynch / Hell Gate) There's a lot going on at Plaza Ortega. A dessert counter stands by the front entrance, with freezers filled with paletas and tubs of ice cream for scooping. You can also get an acai bowl up here, though that feels like a stretch. The market area is festive and fun, with an excellent selection of Mexican snacks, sweets, and sauces. But if you're here to eat dinner, go right to the counter about halfway through the place, check out the menu, place your order, grab the little number sign, and find a place to sit. Out front on Myrtle, semi-shielded by plant life, are several tables, and inside in the back are a bunch of stools in a spiffy new tiled bar/dining area, party music blasting from the TV. The menu is lengthy and appealing, and everything is good, but get the Birria Combo, which features three saucy, stewed-meat tacos—Ortega uses beef for his birria—and a bowl of what just might be the absolute best consomme in town. Seriously: you will definitely want to straight-up drink this stuff. Ortega also makes Birria Ramen, which is just a Cup o' Noodles prepared with the consomme and meat. Gringa campechano ($5) (Scott Lynch / Hell Gate) Another big winner here is the Gringa, a flat flour tortilla that comes grilled and gooey with melted cheese and piled with your choice of meat. I recommend the Campechano for this beast, which is chopped up beef and chorizo, mixed together, and topped with crisp potato sticks. Dump some of the green sauce on this beauty for an extra jolt of pleasure. In fact, the Gringa is so good I'd say skip the regular fish taco, and the regular al pastor one, and just get another one of these instead. Torta milanesa de pollo ($10) (Scott Lynch / Hell Gate) The Milanesa de Pollo Torta also rules. This is a big, juicy sandwich, not too bready, loaded with chicken cutlet, avocado, jalapeno, lots of soft, salty queso blanco, mayo, and a smear of black beans. So good. Ortega and his crew also make burritos, Enchiladas Suizas, chilaquiles, nachos—enough variety to keep things lively. Did you just move into that $3,700-a-month apartment upstairs? Oh man, you are set for meals from here on out. Hell Gate total for two, including tax but excluding tip and a very good Mango Chamoyoda: $39.22 Plaza Ortega is located at 140 Stanhope Street, at the corner of Myrtle Avenue, and is currently open on Thursday through Tuesday from 10:00 a.m. to 11:00 p.m. Closed Wednesdays (347-365-1086) Already a user? Log in Thanks for reading! Give us your email address to keep reading two more articles for free Email Register See all subscription options",,,,
