New Bed-Stuy Bar Boasts Beautiful Burger,https://hellgatenyc.com/new-bed-stuy-bar-boasts-beautiful-burger,1452 Fulton Street,Three Maples (https://example.com/three-maples),"1452+Fulton+Street,+NYC",Three Maples,40.6799097,-73.942727,https://example.com/three-maples,,,,"Three Maples, a spacious new bar in Bed-Stuy that serves a short, appealing menu of first-rate food, probably wouldn't exist if the pandemic hadn't upended everything three years ago. Back in pre-pandemic times, Matthew Lief, Michael Felix, and Maria Dela Cruz were plenty busy with their Landhaus operation, running a stand at Berg'n in Crown Heights, spending weekends slinging food at the Smorgasburgs, and setting up shop at festivals like Gov Ball. (Scott Lynch / Hell Gate) Berg'n never reopened after the initial COVID lockdown and, after a stint doing meal delivery for the city, Lief, Felix, and Dela Cruz started plotting how to pull off an idea they'd been tossing around since they first met as sous chefs  at the fancy Hotel Pierre in Manhattan. ""We just wanted to do a neighborhood bar,"" Lief told Hell Gate, ""and build up a following the old-fashioned way, through the quality of our food, drinks, and atmosphere."" And so last week we got Three Maples on Fulton Street, right near the Kingston-Throop C train stop. Its vibes are very much what they envisioned—a comfortable, welcoming place to post up for a few beers and grab some simple, well-executed food that's better than you'd expect from a neighborhood bar. Smoked barbecue wings, $15 (Scott Lynch / Hell Gate) Though all three partners are chefs by trade, Dela Cruz runs the kitchen at Three Maples, which serves a few classic Landhaus bangers as well as enough new dishes to keep regulars excited. The burger is the place to start, mostly because it's awesome. A four-ounce patty is topped in the traditional fashion (lettuce, tomato, onion, melted American) with a bunch of ""haus sauce"" glopping things up. Very solid fries, too. I lived two blocks away from Three Maples for around five years, and on so many winter nights wished there was somewhere close by I could sit and chill and eat a plate of food like this with no fuss for under twenty bucks. Too late for me, but not for thee. Fish and chips, $17 (Scott Lynch / Hell Gate) There's a fried chicken sandwich here too, spicy with scotch bonnets, sweet with pickle slaw (also served with fries, or a salad if you're feeling dainty), and a comically long and large slab of beer-battered haddock served over a bed of chips (in this case, fries). All of these are dinner-sized portions, but there's some good shareable stuff here as well, led by the team's ""world famous"" Landaus bacon (smoked in-house, slow-roasted for maximum tenderness, and slick with maple syrup). The barbecue wings are also crazy smoky, and the eloté dip (which is exactly what it sounds like), is so much fun it could easily supplant the bacon as the joint's signature snack. The Caesar, $9 (Scott Lynch / Hell Gate) Landhaus bacon, $10 (Scott Lynch / Hell Gate) Eloté dip, $8 (Scott Lynch / Hell Gate) A couple of salads (the cheesy Caesar was decent), offer optional add-ons like lardons, grilled chicken, or shrimp skewers to make an under-twenty-dollar meal. Charred broccoli with garlic and chili flakes and that ""old-standby"" blistered shishito peppers round out the food options for now. House cocktails are $15 and under, there are wines by the glass or bottle, and a draft beer from brewers like Industrial Arts, Grimm, and Mast Landing will set you back like nine bucks. Sit at the long marble bar, or at the even longer marble counter, or at one of the baller banquettes in the front and back of the place. (Scott Lynch / Hell Gate) ""This is our first brick and mortar where we have full control over everything,"" said Lief. ""Where we're not just an amenity at someone else's bar. We're rooted here."" (Scott Lynch / Hell Gate) Three Maples is located at 1452 Fulton Street, between Kingston and Tompkins Avenues, and is currently open from 4:00 p.m. to 12:00 midnight on Wednesday, Thursday, and Sunday, and from 4:00 to 2:00 a.m. on Friday and Saturday. Look for happy hour specials from 4:00 to 6:00 (347-365-9382) Already a user? Log in Thanks for reading! Give us your email address to keep reading two more articles for free Email Register See all subscription options",,,,
Next Stop Vegan Brings Next-Level Plant-Based Dominican Food To Downtown Brooklyn,https://hellgatenyc.com/next-stop-vegan-brings-next-level-plant-based-dominican-food-to-downtown-brooklyn,88 Livingston Street,"Slutty Vegan (https://www.bkmag.com/2022/09/23/slutty-vegan/), Lekka Burger (https://gothamist.com/food/amanda-cohen-lekka-plant-based-burger-tribeca)","88+Livingston+Street,+NYC",Slutty Vegan,40.6912119,-73.9907069,https://www.bkmag.com/2022/09/23/slutty-vegan/,,,,"A plant-based lifestyle didn't come naturally to Blenlly Mena, the co-owner, with her boyfriend Javier Saba, of Next Stop Vegan, which just opened its second location in Downtown Brooklyn near Court Street. ""I was born and raised in the Bronx, Grand Concourse and Kingsbridge,"" Mena told Hell Gate. ""Veganism was not a thing in my upbringing."" But when her father passed away right before she graduated college, Mena said she ""started to take an interest in healthier eating"" and, in 2014, adopted a plant-based diet ""as an experiment"" and it changed her life. ""It reversed my cholesterol,"" she said. ""I lost drastic weight, and experienced an amazing transformation. Next Step Vegan arose from that whole journey."" Mena's first venture was in the Bronx, though it was more of a ""vegan meal-prep business"" than a restaurant, and has since closed. Then in the summer of 2021 she and Saba opened a counter-service version of Next Stop Vegan in Washington Heights, ""right in the middle of all these pernil places, roasting chickens in the window, and chicharrones,"" and it's been a hit. So much so that the pair have already expanded with this charming spot on Livingston Street, on the border of Brooklyn Heights and Downtown Brooklyn. (Scott Lynch / Hell Gate) Next Stop Vegan stars an impressively lengthy menu of comfort food classics, and everything is made from plant-based ingredients. There are Chickn' Tenders with fries, for example, and a Pulled 'Pork' sandwich, a bacon cheeseburger-ish creation called the Veganator, and a Philly Cheesesteak. Restaurants built around these sorts of ""vegan gateway"" dishes for the curious have become increasingly common over the past few years, at places like the rowdy Slutty Vegan in Fort Greene, the activism-minded Grilled! in Bushwick, and Amanda ""Dirt Candy"" Cohen's Lekka Burger in Tribeca. But what distinguishes Next Stop Vegan from those spots is that most of the menu here skews toward vegan versions of Mexican or Dominican favorites. For example, there's a terrific take on the Dominican street-food sandwich called the chimi, with the usual beef or pork patty swapped out for a housemade black bean and brown rice concoction that brings plenty of life to the party. It's basically a burger, but on soft Portuguese bread, and topped with crisp cabbage, tomato, and a lively orange chimichurri sauce. (You can also get this messy beast sandwiched between fried tostones instead of bread, but we wouldn't call it ""healthy."") The Twisted Burrito, $15.99 (Scott Lynch / Hell Gate) There's some good vegan stoner food here as well, including a ""twisted burrito"" packed with grilled portobellos, creamy mac-n-cheese, seasoned ground fake-beef, chunky pico de gallo, avocado, soy cheese, and several sauces, all accompanied, perhaps unnecessarily, by tortilla chips. It's a belly bomb for sure. El Plato with portobello mushroom pepper steak, $15.99 (Scott Lynch / Hell Gate) For a more traditional and equally hearty meal, order El Plato, a classic lunch-counter rice-and-beans platter with sweet, sticky plantains, avocado salad, and hunks of portobello done up pepper steak-style. Those plantains can also be ordered as a side, and they are caramelized to perfection. There are tostadas, tacos, nachos, loaded-up vegan mofunguitos—we could go on, and we promise you won't get bored at Next Stop Vegan. And the beverage selection is inspired, with everything from homemade juices (guava, soursop, and passion fruit) to kombucha to Coco Rico and Jarritos. Sweet plantains, $4.99 (Scott Lynch / Hell Gate) The space itself is cute and welcoming, with lots of personal touches like plastic flowers hanging from the ceiling, chalk murals, board games, books about crystals and such, and cute dioramas starring happy animals who aren't being slaughtered and eaten. Mena and Saba are opening a vegan grocery area as well. ""Javier is the visionary,"" said Mena. ""All the little intricate details are his, bringing love and creativity to create a space where we could come together and have a good time. You're saving the planet, you're saving your health, you're saving so many animals."" The new Next Stop Vegan is located at 88 Livingston Street, between Court Street and Boerum Place, and is currently open Monday through Thursday from 11:00 a.m. to 8:00 p.m., on Friday and Saturday from 11:00 to 9:00 p.m., and on Sunday from 11:00 to 6:00 (917-966-6066) (Scott Lynch / Hell Gate) Already a user? Log in Thanks for reading! Give us your email address to keep reading two more articles for free Email Register See all subscription options",,,,
Start 2023 Right With Mucho Sarap’s Filipino Tacos on Canal Street,https://hellgatenyc.com/20-dinner-mucho-sarap-canal-street,265 Canal Street,Mucho Sarap (https://www.instagram.com/sosarapnyc/),"265+Canal+Street,+NYC",Mucho Sarap,40.7191119859049,-74.0008703461691,https://www.instagram.com/sosarapnyc/,,,,"The idea for Mucho Sarap, a new Filipino taco stall located inside the Canal Street Market, first started taking shape in pre-pandemic times, in the kitchen of Soho hotspot Lure Fishbar. It was there that chef VJ Navarro, who was born in Italy, and grew up in Flushing, but whose family fiercely maintains and celebrates their Filipino heritage, met his mentor, chef Neptali Mendoza, who introduced him to Mexican cooking. ""Filipino food is hard to put out there,"" Navarro told Hell Gate while ladling out some killer consome from a burbling pot. ""It's very heavy, with a lot of going on. So I thought by combining it with Mexican food, in an easy bite like tacos, more people would try it."" First, though, Navarro and his high school friend Sebastian Shan launched So Sarap, a classic Filipino street food stand (think: chicken heads, pig's blood skewers, and balut) that popped up in September of 2020 on Allen Street and has since ensconced itself at both Smorgasburg locations in Brooklyn. Don't worry, fishball fans, So Sarap is not going away. But when a booth at the newly rejuvenated Canal Street Market became available, Navarro saw it as the perfect spot to roll out his more accessible-to-the-masses concept, Mucho Sarap. (Scott Lynch / Hell Gate) Not that the food here is timid. ""All dishes are based on Filipino food, with Mexican tortillas and sauces,"" said Navarro. ""We're trying to combine two cuisines into one without losing the flavors of either."" Taco de Nilaga, $5 (Scott Lynch / Gate) And so we have things like the Taco de Nilaga, an extremely rich and juicy Filipino stew, made here with beef short ribs, cheeks, and tongue, piled onto a decent corn tortilla and capped with lots of onion. This is terrific, especially if you dump on some of the accompanying red sauce and/or green sauce. The Consome de Nilaga is a weekend special (Scott Lynch / Hell Gate) And if you come on the weekend and they're serving Consome de Nilaga, get it with a taco or two for dipping. It's one of the best bowls of anything I slurped down in 2022. Taco de Longaniza, $5 (Scott Lynch / Hell Gate) The Taco de Longaniza is also very good, the sweet pork sausage chopped into tiny pieces and, if you choose (you should choose), topped with pickled jalapeños and onions. The taco piled with apritada, a tomato-based chicken stew, is less exciting. Definitely get the Lumpia Guac, which is as simple and fun as it sounds, just five fried, pork-filled spring rolls sticking out of a mound of creamy guacamole. Essentially: chips and dip. The avocado needs a little more oomph, however, so feel free to add that spicy red sauce, or some pickley things, or even bits of the fiery dried chiles before scooping. Lumpia Guac, $15 (Scott Lynch / Hell Gate) Lumpia Chiladas, $15 (Scott Lynch / Hell Gate) The Lumpia Chiladas is probably the most clever of Navarro's cuisine mashups, with the Filipino vegetable spring rolls treated as enchiladas, covered in gooey cheese, a mess of cilantro, and drenched in traditional Mexican sauce. And it's all pretty filling. Go with a buddy, get two tacos each, split one of the lumpia dishes, and you'll still have enough left over for a Jarritos or two. (Scott Lynch / Hell Gate) The whole Canal Street Market felt festive and alive when Hell Gate went last week, with the decked-out Mucho Sarap booth leading the way. The design here is meant to evoke the Tindahan, the Filipino equivalent of the bodega, with the ""storefront"" in the back (the snacks and such hanging behind the chicken wire are just decor for now, though Navarro is actively seeking a distributor so he can sell the genuine goods) and people hanging out front on the ""sidewalk"" drinking, eating, socializing. The Mucho Sarap booth is decked out like a Tindahan, the Filipino equivalent of the bodega  (Scott Lynch / Hell Gate) ""We're bringing the Filipino streets to New York,"" said Ariane Demesa, who is married to Navarro and called herself the Mucho Sarap spokesperson. ""Maybe we'll set up karaoke next."" (Scott Lynch / Hell Gate) Mucho Sarap is located within the Canal Street Market , located at 265 Canal Street, between Broadway and Lafayette, and is currently open from 11:00 a.m. to 8:00 p.m. daily. If you can't get one of the bright yellow stools in front of the booth there's a large communal dining area in the back of the market. Already a user? Log in Thanks for reading! Give us your email address to keep reading two more articles for free Email Register See all subscription options",,,,
Feast on Nigerian Delights at Rockaway Beach This Summer,https://hellgatenyc.com/nigerian-delights-the-cradle-rockaway-beach,194 Beach 96th Street,The Cradle (https://www.instagram.com/thecradlenyc/?hl=en),"194+Beach+96th+Street,+NYC",The Cradle,40.5850899,-73.8177715,https://www.instagram.com/thecradlenyc/?hl=en,,,,"Jide Alao didn't start surfing until he was fifteen years old, when he and his family moved from Lagos, Nigeria, to the Rockaways. Right away, he fully embraced the scene at the surf-only stretch around Beach 69th Street, but as he told Hell Gate, ""One summer, I realized there was something missing. There's no West African food here! Having this in the Rockaways would be amazing."" So in 2019, Alao, who grew up hanging out at his mom's restaurants back in Lagos, and his wife and business partner Pesy Sikyala started selling jollof rice bowls on the boardwalk from a food cart, which they supplanted the following year with a full-fledged brick-and-mortar counter service spot on Beach 96th Street called The Cradle NYC . The Cradle on Beach 96th Street. (Scott Lynch / Hell Gate) He was, in turns out, correct—having this cuisine out here is, indeed, amazing, and The Cradle is an excellent addition to a stacked line-up of rad beach food options. Now entering its third summer in the original Rockaway Taco space, The Cradle serves a full menu of classic Nigerian dishes, led by a terrific egusi, a luxuriously thick West African stew whose rich flavors come from the namesake melon seed, plus locust beans, greens, crawfish, and dried fish. Alao also mixes in your choice of protein, and we opted for chicken. The best-sounding meaty add-on, ""cow foot, goat meat, and beef tripe,"" had a $3 upcharge, which would have busted our $20 Dinner budget by a buck. But you go ahead and live it up, Rockefeller. Egusi with chicken and iyan, $18. (Scott Lynch / Hell Gate) The egusi also comes with a starchy side of okele, and your choices here are either eba, which is made from cassava flour, or iyan, a gummy ball of pounded yam from which you pull off stretchy pieces with your hand to scoop up your stew. You don't have to use your hands, of course; there are spoons and forks readily available at the counter. But as Alao told us, ""When you eat with your hands, there's a sensual bond between you and the food. You can feel the heat of the food and the texture, so it's a lot more like your whole being is coming into play. That's the beauty of eating our food."" To that end, he's installed a sink right by the outdoor dining area if you want to wash up before you dive in, fingers first. Our reporter eating with his hands, for maximum sensuality. (Scott Lynch / Hell Gate) All of the above can also be had with a spinach-forward stew called efo riro as the base, or with Alao's okra stew. You can also get one of the jollof rice bowls, piled high with sweet plantains, vinegary kale salad, or roasted broccoli, and your choice of salmon, chicken, or beef. Alao said that the inclusion of kale salad in the jollof was initially met with derision among Rockaway's Nigerian community, but he's since seen social media posts by those same naysayers adding it to their home-cooked meals, so who's laughing now? As Alao put it, ""I'm not saying I started a trend, but..."" Salmon jollof rice bowl, $20. (Scott Lynch / Hell Gate) The stews and the jollof bowls are all large, filling meals, so if you want something snackier, the yuca fries, samosas, or sweet puff-puffs are the move. Alao is proud of his juice and smoothie menu as well, the latter in flavors like Jack (jackfruit, spinach, mango, banana) and Peanut Vibes (starring peanut butter and blueberries). And watch for off-menu specials on Fridays this summer, which Alao promised would highlight ""Nigerian street food, all the way, no modern twist, just authentic stuff."" Yuca fries, $3. (Scott Lynch / Hell Gate) The Cradle can also be found at the Riis Park concessions this season, and Alao said he plans on breaking out the cart again and showing up on the streets of Brooklyn and Manhattan. ""We have a lot of regulars now,"" he said about his flagship on Beach 96th. ""People were a little standoffish at first, but now they walk by and see a diverse group eating here, which brings a sense of belonging to everyone. Like, 'Oh, I can eat here too.' It's really been fun talking to people. I really enjoy feeding my community."" The Cradle is located at 194 Beach 96th Street, between Rockaway Beach Boulevard and the Atlantic Ocean, and is currently open on Wednesday through Sunday from 10 a.m. to 9 p.m. (347-619-9120) Already a user? Log in Thanks for reading! Give us your email address to keep reading two more articles for free Email Register See all subscription options",,,,
NYC’s Hottest Club Is This Bonkers Hong Kong-Style Diner on Doyers Street,https://hellgatenyc.com/nycs-hottest-club-mabu-cafe-doyers,18 Doyers Street,"Mabu Cafe (https://mabucafe.com/), Mabu Cafe (https://mabucafe.com/)","18+Doyers+Street,+NYC",Mabu Cafe,40.7145739,-73.9980045,https://mabucafe.com/,,,,"Cecilia Huang, the manager here at Toronto import Mabu Cafe , said she was stunned by the long lines that appeared on Doyers Street a few weeks ago when this Hong Kong-style cha chaan teng, or casual ""tea restaurant,"" first opened in the subterranean space that used to be Sanuria. ""We didn't do any type of advertising yet,"" Huang told Hell Gate. ""This is a soft opening, and we were so surprised that so many people showed up that we got caught short-handed. We have a second floor [at street level] that we haven't even used yet because the kitchen and team want to make the food really good, instead of just making more money."" It's a scene on Doyers Street. (Scott Lynch / Hell Gate) A good plan! Especially since the literally, physically massive menu at Mabu Cafe is packed with dishes that not only feature three or four things all piled on top of each other, but everything is also assembled to look as cute as possible. (Scott Lynch / Hell Gate) (Scott Lynch / Hell Gate) It's a high-wire act for sure, but for the most part, they pull it off. This place serves some first-rate stoner food, usually involving some sort of gimmickry, in a room that leaves no opportunity for sensory overload left unexplored. If you're not cracking a smile throughout your meal here, I don't know what to tell you. Live a little! Tom yum goong seafood instant noodle soup, $15.99. (Scott Lynch / Hell Gate) My favorite dish, and I tried a lot of them, was probably the seafood instant noodle soup, which arrived cascading, in frozen, gravity-defying fashion, from its faux Cup Noodles container. The mussels lurking within were plump and tender, and the shrimps hanging from the side had a nice snap to them. My friendly server told me to dump everything out on the plate and pour on the orange tom yung goong sauce, which she warned me was spicy but really was only moderately so. It basically ate like a mountain of chewy, gloppy pasta, and it made me happy. It's a silly dish for sure, but you could tell that someone was paying attention in the kitchen. And there are, like, ten other variations of this dish too, the noodles laden with items like pork cracklings, satay beef, or cuttlefish balls. Molten salted egg yolk French toast with pork floss and maple syrup, $9.99. (Scott Lynch / Hell Gate) There's a lengthy Hong Kong-style French toast / pineapple bun section of the menu, everything under ten bucks and stuffed with stuff like ""assorted meat"" or vanilla ice cream or molten salted egg yolk strewn with pork floss. This latter sandwich was terrific, all oozy and seductive with big flavors. Cheesy baked bread bowl with spaghetti and pork cutlet, $19.99. (Scott Lynch / Hell Gate) Want more carbs? There are a half-dozen different cheese baked bread bowls available. I ordered mine loaded with spaghetti and an entire pork cutlet, hacked into bite-sized pieces, which turned out to be a little overwhelming, actually, but again, I was impressed with how much care they put into each individual component. Hog maw with chicken hot pot. (Scott Lynch / Hell Gate) Mini hot pots are such a good idea that I'm surprised more places don't have them, though at Mabu Cafe, since all of the ingredients (a bunch of good, funky hog maw; some bright red jujube, or Chinese dates) are already burbling away in the broth when it gets to your table, it's more like a big bowl of soup sitting on a pedestal of live flames. A little dicey to have perched at the edge of your overcrowded table to be honest, but we all made it through the meal without catching fire. Deep fried squid tentacles, $8.99 (Scott Lynch / Hell Gate) Did you think we were done? We are not done. The snacks section features rice rolls; cheese fries; and many deep fried things, including milk custard, chicken wings, and squid tentacles, served somewhat charmingly on a plastic toy of a scale. Handle these latter guys with care! The top tray part is not attached to the bottom scale part, and if you just start grabbing it haphazardly, you, like me, may end up with a lapful of cephalopod. Ice bear in a bath of coconut milk with jellies, $8.99. (Scott Lynch / Hell Gate) And before any of the above was eaten, dessert was served, an adorable ice bear (as in, a little teddy bear made out of ice) soaking in a bathtub of coconut milk and various jellies. A delicious and refreshing way to start a meal. There's so much more here, too, but I'll let you discover the rest. (Scott Lynch / Hell Gate) The basement dining room (and the stairwell down to the basement dining room) is a riot of neon, random toys, advertisements, murals, posters, newspaper clippings, and accessories by brands and artists with vibes similar to Supreme and Bear Brick and Kaws. The tables are covered in mahjong tiles under glass. The bathroom is behind a refrigerator door labeled SMEG. ""The theme is like if you go to Hong Kong, this is what it was like there in the '90s,"" said Huang. ""My husband is from Hong Kong, and he said this looks exactly like the old times."" (Scott Lynch / Hell Gate) Mabu Cafe is located at 18 Doyers Street, close to Pell Street, and is currently open from 10:00 a.m. to 6:00 p.m. daily, with dinner hours coming soon. I waited over an hour for a table starting at 2:30 in the afternoon on a weekday. Already a user? Log in Thanks for reading! Give us your email address to keep reading two more articles for free Email Register See all subscription options",,,,
