Wegmaniacs Beware: The Prepared Food at the New Astor Place Wegmans Is Awful,https://hellgatenyc.com/wegmans-astor-place-prepared-food-awful,770 Broadway,Wegmaniacs (https://example.com/wegmaniacs),"770+Broadway,+NYC",Wegmaniacs,40.7306938,-73.9915383,https://example.com/wegmaniacs,,,,"On Wednesday morning, East New York resident Jordan White woke up hours before dawn to make his way to Astor Place and get on line to do some grocery shopping. When I met him, he had been waiting since 4 a.m. to get into the brand-new 87,500-square feet Wegmans supermarket, which now fills the two-story space where Kmart used to be. ""It's a momentous occasion,"" White told Hell Gate. ""I love seeing everyone excited for the new store, seeing everything as fresh as can be, even though Wegmans is very big on quality so everything every day is fresh. I'm from Rochester, moved here in 2016, and there weren't a lot of options that I felt like I could go to and get pretty much everything I wanted in one place. Not like Wegmans."" If this sort of passion for a grocery store chain is surprising to you, then you've obviously never spoken with a Wegmans true believer. A Wegmaniac, if you will. Wegmaniacs on line about an hour before doors on opening day. (Scott Lynch / Hell Gate) Wegmaniacs tend to talk that way about this place, as if they're parroting ad copy. Take Bradley Orego, who drove from Buffalo to throw an opening day tailgate party on the sidewalk with his buddy, Bushwick resident Jeff Pollock, giving out plates of pancakes to passersby. ""Wegmans has been such an important part of my life. I grew up with Wegmans,"" Orego explained. ""Any time I'm not in a city that has a Wegmans, I'm like, you don't know what you're missing, it's a different experience. What I tell folks is that the quality of the goods is so high, but the prices are not, and that's what makes Wegmans special."" (Scott Lynch / Hell Gate) The family-owned supermarket chain started in Rochester in 1916, and today, there are more than 110 stores along the East Coast. New York City got its first Wegmans in 2019 at the Brooklyn Navy Yard, and opening day there was a chaotic scene . Politicians were on hand for a ribbon cutting, hundreds of people waited for hours in the pouring rain on Flushing Avenue to get inside, and the 700-car parking lot was filled to capacity. But for most of us, the Navy Yard is a pretty useless location for a grocery store, catering more to car owners and drivers than subway and bus riders, cyclists, and pedestrians. Astor Place, on the other hand, is a core New York City location, with multiple subway lines within easy walking distance, the iconic Cube across the street, and loads of late-night memories lurking for anyone who's lived here for more than a minute or two. And the building itself, which once housed an annex to the original Wanamaker's department store, is an official City landmark. I spent nearly three hours at the Astor Place Wegmans on opening day. Beginning with the good news first, the enormous lower level is stocked with everything you could hope to find in a supermarket, from good junky snacks and soda to paper goods and drugstore stuff to mountains of produce and multiple shelves of kombucha. Most exciting for me, the ice cream selection is solid as hell, highlighted by pints of Graeter's, the great Cincinnati brand that's hard to find in New York City. Just a few of your options at the fish counter downstairs. (Scott Lynch / Hell Gate) There's a huge butcher section, with lots of cheese sporting corny names like We Be Chivin' and Sake2Me, and a deli with plastic packages of pre-sliced meats. Most interesting (and, these days, pretty unique in the city) is the somewhat pretentiously named Sakanaya (Japanese for ""fish counter""), which features an almost comically large and diverse selection of whole fish. You can get any of these cleaned and filleted on the spot, and one of the mongers will walk you through the best ways to cook it. Almost nothing down here seemed either outrageously overpriced or blessedly cheap, though there are some super luxe items thrown in for the NoHo crowd, like the $72 one-pound whole thornyhead fish flown in from Japan, and the $240 per pound snow-aged A5 Wagyu strip. Really, it's on the store's main floor, home to Wegmans's vaunted selection of hot dishes, sushi, and prepared meals, that the whole ""land of plenty"" promise falls apart. It's where Wegmans's vast quantities and gleaming surfaces and super-friendly service can't hide the fact that the food up here just isn't any good. The worst slice of pizza I had all year, $4. (Scott Lynch / Hell Gate) The pizza, for example, which comes in a half-dozen varieties and is made on the spot, is awful. It probably doesn't help that there are decent slice shops galore in this part of town, including the excellent Funzi's a block away, but still, you can't land in the East Village slinging this sort of bland, gluey nonsense and expect to get away with it. Maybe they should hire some local talent to run this department? There's a hot sandwich stand, with offerings like chicken shawarma, pastrami, Kobe beef, and a really sad excuse for a Cuban, which is dominated by thick slices of cold boiled ham. As for the other items I tried, I figured I was playing it safe with the Buffalo chicken soup—I mean come, this is a Western New York outfit, no?—but somehow, it tasted mostly of carrots. The slightly spicy Buffalo wings were a little better. The sweet barbecue wings were a little worse. Tuna volcano roll, a total gloppy disaster, $11.99. (Scott Lynch / Hell Gate) Please take my advice: Don't get the tuna volcano roll. I probably don't need to tell you that—sushi drenched in various mayos is never a good idea—but just in case you get struck by a fit of ""when in Rome"" recklessness like I did, know that it's a gloppy, unfinishable disaster. And was the best thing I ate all afternoon a pair of mediocre mall-ish cookies? Maybe. They certainly were very sugary. Another cause for discouragement—unlike the Navy Yard Wegmans, which offers cafe-style seating for 140 people both indoors and out, there's nowhere to eat on the premises. Yes, a sushi bar and a ""champagne and oyster"" restaurant are coming next year, in the currently walled-off space just to the left of the entrance, but all of us soup-and-sandwich peasants will still have to leave the store and grab a table (or a rock) across Lafayette at the Astor Place plaza. Admittedly, the fact that a supermarket's prepared food is boring or bad isn't exactly breaking news. But since Wegmans highlights that part of their operation—most of the main floor is turned over to all the various grab-n-go stations—it seems worthwhile to suggest that, upon entering, you head straight downstairs and get your grocery shopping done. Half a sad Cuban, $8; timid Buffalo chicken soup, $5.99. (Scott Lynch / Hell Gate) Or just wander around a bit and vibe out! As NYU student Charlotte Wyman told me on her way home, arms laden with Wegmans jelly beans, chocolate chips, and baby carrots, ""It was so entertaining, so much fun in there. I had a great time. I love grocery stores in general, so it was really an exciting experience. It felt like Disney World."" Wegmans Astor Place is located at 770 Broadway (the entrance is on Lafayette and Eighth Street), and is currently open from 7 a.m. to 10 p.m. daily. Already a user? Log in Thanks for reading! Give us your email address to keep reading two more articles for free Email Register See all subscription options",,,,
Feast on Phenomenal Filipino Food at Patok by Rach in Inwood,https://hellgatenyc.com/patok-by-rach-in-inwood-review,5057 Broadway,Patok by Rach (https://hellgatenyc.com/patok-by-rach-in-inwood),"5057+Broadway,+NYC",Patok by Rach,40.8705144657982,-73.9156902391263,https://hellgatenyc.com/patok-by-rach-in-inwood,,,,"The first time Rachel Saberon fed me her lechon, we were standing under the arches of Harlem, along with thousands of other hungry people, in the spring of 2022. That's when she and her business partner Hannah Abada made their debut as Patok by Rach at the Uptown Night Market. The Filipino roasted pig they served that evening was incredible, so fatty and funky, so sticky and sweet. Patok basically means ""a hit"" in English, and this pig definitely was that. Dunking that pork belly into a vat of bubbling oil for the chicharron. (Scott Lynch / Hell Gate) A month later we met again in the Bronx at Fordham Plaza, and a month after that I wolfed down her pork belly at Industry City in Brooklyn. Just a legendary run of lechon! But as fun and cool as it is to eat this stuff at seasonal outdoor markets, I thought: Wouldn't it be great if we could just get Saberon and Abada's roasted pork every day if we wanted? Like at an actual restaurant? And maybe other Filipino delights like lumpia and chicharron too? Lechon kawali, or chicharron, $18.99. (Scott Lynch / Hell Gate) If you live up in Inwood, or don't mind hopping on the A to the end of line for a delicious piggy feast, then that dream just became a reality—Patok by Rach, the brick and mortar restaurant, is now up and running seven days a week on upper Broadway. Sample of marinated and grilled chicken inasal. (Scott Lynch / Hell Gate) ""This was a long-time prayer,"" Saberon told Hell Gate. ""I lived here two years ago and there just wasn't enough Asian food around. I believe we're the first Filipino restaurant in the area, which I think is bizarre. Filipino and Latin food are very similar, so I thought it was a no-brainer. This is a neighborhood where people really appreciate their pork."" Inside Patok by Rach. (Scott Lynch / Hell Gate) Saberon was born and raised in Cagayan de Oro, in Mindanao in the Philippines. But her lechon recipe, she told us, ""came from my father who grew up in Cebu City."" It's a fantastic plate of pig, with crackling skin and big hunks of soft, juicy meat, served with a mound of rice and three crocks of sauce—one dark and vinegary, one a cucumber salad that's basically little chunks of pickles, and a third filled with a rich and sludgy liver-based condiment called Mang Tomas, or ""Filipino gravy,"" as Saberon put it. Sample of the lechon belly. (Scott Lynch / Hell Gate) The regular lechon is actually slightly over our official $20 Dinner budget (it's $22.95), but Patok's lechon kawali platter, in which slabs of pork belly are deep fried like chicharron, is $18.99 and just as delicious—albeit slightly more perilous if your teeth are prone to cracking. I love both of those dishes at Patok, and would happily eat either of them at least once a week if I lived up in Inwood—but I think Patok's pork sisig may be even better. This is the best version of the Filipino classic that I've ever had. The pig is diced, seasoned, and fired under high heat to a tender, chewy, intensely pleasurable finish, and the slivers of jalapeños scattered on top are a nice touch. Pork sisig, $18.99. (Scott Lynch / Hell Gate) Other fire-roasted fare includes some good-looking pork skewers and a remarkably smoky piece of roast chicken. And it's not all meat, either. The Patok's pork lumpia is excellent, boasting an impressive amount of flavor for such a skinny package, but the veggie version is almost as good. There's also liang, made from dried taro leaves and coconut milk, and a tofu and mushroom dish. Sadly, the freezer was on the fritz last week, so I couldn't try Patok's ice cream-topped halo-halo for dessert. Next time. Veggie lumpia, $10. (Scott Lynch / Hell Gate) For the Patok team, who are used to churning out lechon in festival tents and compact commissary kitchens, the space itself here in Inwood is luxuriously expansive. But the first thing you'll think is: holy shit there's a tree in here! It's just a sculpture (though it looks pretty real), and it was actually already inside, hidden behind the roll gates, when Saberon and Abada first saw the place, installed by the contractor for a different business that never saw the light of day. Purely by coincidence, it's a narra, the national tree of the Philippines. ""We looked at each other and were like, this is it,"" said Saberon. Patok by Rach is located at 5057 Broadway, between 215th and 216th Streets, and is currently open from 12:00 p.m. to 9:00 p.m. daily (914-424-6677) . Already a user? Log in Thanks for reading! Give us your email address to keep reading two more articles for free Email Register See all subscription options",,,,
Bed-Stuy’s Stellar New Bakery Bread and Butter Is Stuffed With Savory and Sweet Delights,https://hellgatenyc.com/bakery-bread-and-butter-bed-stuy-review,53 Rockaway Avenue,Bread and Butter (https://example.com/bread-butter),"53+Rockaway+Avenue,+NYC",Bread and Butter,40.6813472,-73.9112416,https://example.com/bread-butter,,,,"In March of 2020, chefs Autumn Moultrie and Brian Villanueva had no dreams of owning their own bakery. Villanueva was working in the kitchen at Blue Hill at Stone Barns, and Moultrie, who moved here from Las Vegas to help open The Grill, had a job at the restaurant and hospitality behemoth Major Food Group and did food styling on the side. The couple lived in Ditmas Park, and the trajectory of their lives seemed clear. COVID, of course, upended all that. When the pandemic hit, both found themselves out of a job, with plenty of time on their hands and, fortuitously, a sourdough starter in their fridge. ""We were regular savory chefs,"" Moultrie told Hell Gate. ""But we just started baking, baking, baking, trying stuff out, and in the building that we were living in, there were a lot of elderly individuals, so Brian started gifting everyone loaves of sourdough."" Word of their baked goods got out through a Facebook group. Soon, the couple ramped up production; Moultrie added her pillowy, beignet-like ""angel doughnuts"" to the mix; and Back Alley Bread was born. Initially, it was an Instagram-driven, delivery-only service, but it eventually morphed into a pop-up in places like Purple Yam and Mallard Drake. ""We always had an issue finding a kitchen we could afford,"" said Moultrie. ""It wasn't like we had saved up money to open up some grand bakery, so we just started bugging random friends to use their bars and restaurants. But there came a point when it was like, maybe we should consider getting more serious about this."" Now, we have the newly renamed Bread and Butter, an actual, physical bakery in the Ocean Hill part of Bed-Stuy which boasts an impressive array of the couple's sweet and savory delights. Walk-ins are welcome, and there's a full coffee menu and some seating, but until Villanueva and Moultrie are able to staff up the kitchen to meet demand, pre-ordering for pickup via their website is the way to go if you want to make sure you can choose from the full menu. Frito pie, $16. (Scott Lynch / Hell Gate) The Frito pie, for example, makes for a phenomenal comfort food meal. Shaped like a classic pot pie and starring a flaky crust that's actually made from Fritos, this hefty beast is filled with a zingy beef chili and melted cheddar cheese. There's also a chicken and biscuit pot pie, and a vegetarian mushroom and herb version. The generously topped focaccia is equally hearty and delicious, whether sold by the slice from the case (there were some French onion slabs, gooey with gruyere and gouda, still available when I was there on a recent Sunday around noon) or as a whole 14-inch by 7-inch ""pie."" I got the superb spicy tomato salami focaccia in the latter size, and I'm still happily reheating slices in the air fryer at home. Spicy tomato salami focaccia, $18. (Scott Lynch / Hell Gate) For a snackier savory treat, both of Bread and Butter's curry-crusted hand pies, either the beef and cheese or the cauliflower and mushroom, really hit the spot. Beef and cheese hand pie and and cauliflower and mushroom hand pie, $7 each. (Scott Lynch / Hell Gate) The sweets here are also excellent all around. There's a textbook brown butter chocolate chip cookie, a chewy pecan bar, a brioche-y honey bun, and a heavenly apple cider caramel yeast doughnut that's guaranteed to make a mess of your face. But for a real, fancy-ish dessert dessert, order a slice of the incredibly good, improbably fluffy coconut and ube cheesecake. The duo really flex their fine-dining chops with this beauty. Honey bun, $5. (Scott Lynch / Hell Gate) ""Our menu's kind of funky,"" said Moultrie. ""We're not your typical bakery. It's definitely a nostalgic love letter to our childhood, mixed in with our restaurant experience. We just try to make good food, and make people happy."" The apple cider caramel donut ($4.50), pecan bar ($5), and coconut ube cheesecake ($7.75). (Scott Lynch / Hell Gate) In addition to expanding Bread and Butter's days and hours going forward, Villanueva and Moultrie, who now live in Bed-Stuy, hope to serve their new neighborhood in ways beyond simply selling pretty doughnuts and delicious loaves of bread. Hosting free baking classes is one of their ideas; stocking a grab-n-go case with salads and such, given away to people experiencing food insecurity, is another. ""I just think it's really important to be a good neighbor. We're working on all of that programming because we don't want to just be an Instagram-famous bakery, or strive to be viral, and have a huge line out front,"" said Moultrie. ""We want to really be part of the community."" (Scott Lynch / Hell Gate) Bread and Butter is located at 53 Rockaway Avenue, between Marion and Sumpter Streets, and is currently open for walk-ins and pick-ups on Thursday, Saturday, and Sunday from 9 a.m. until it’s sold out. For the best selection, pre-order online . (Scott Lynch / Hell Gate) Already a user? Log in Thanks for reading! Give us your email address to keep reading two more articles for free Email Register See all subscription options",,,,
Cloud Offers Up Reliable Vietnamese Comfort Food in the LES,https://hellgatenyc.com/cloud-vietnamese-lower-east-side-clinton-street,79 Clinton Street,Cloud Vietnamese Comfort Food (https://example.com/cloud-vietnamese-comfort),"79+Clinton+Street,+NYC",Cloud Vietnamese Comfort Food,40.7189233449358,-73.9852736633213,https://example.com/cloud-vietnamese-comfort,,,,"The story behind Cloud, a Vietnamese restaurant that opened about a month ago on the Lower East Side, began in the 1960s in a northeastern province of Thailand called Nakhon Phanom, according to co-owner Chan Maneesilasan. Maneesilasan's family is originally from that province, which is near the border of Vietnam, he told Hell Gate. ""And many decades ago, Vietnamese refugees came to settle there, and became friends with our grandmas, and they all exchanged recipes,"" Maneesilasan explained. ""With Cloud, I want to honor these grandmas, honor the friendship they all shared and the passion for food between cultures."" Not that Cloud is some sort of experimental Thai-Viet fusion restaurant—the menu here mostly plays it safe, dominated as it is by familiar Vietnamese fare. But cold weather is coming, when sometimes all you want is a big bowl of warm noodles, and Cloud definitely delivers on the comfort food front. There's some good pho to be had, a big bowl of restorative gingery broth swimming with slippery rice noodles and several types of beef: thin-sliced eye round, fatty tendon, fun little meatballs. Other noodle-based dishes include bahn cahn, which is heavy on the pork, and the stir-fried pho xao. Pho, $17. (Scott Lynch / Hell Gate) The fried appetizer selection also covers well-trodden ground, with items like chicken wings and ribs (both are served with honey fish sauce), as well as calamari. One slightly more offbeat offering here is Cloud's version of cha gio, which finds the crispy spring rolls stuffed with both ground pork and a whole shrimp, as well as jicama and mushrooms. Cha gio stuffed with ground pork, shrimp, and mushroom, $14. (Scott Lynch / Hell Gate) Another snacky, satisfying option are the mackerel rolls, which sub out the more common shrimp for filets of the oily fish, stuffed in there with the usual rice vermicelli and crunchy vegetables. Served chilled, they're especially good when dunked in the accompanying peanut sauce, and less good when dipped in the also-accompanying ""tangy mayo."" Mackerel rolls, $14. (Scott Lynch / Hell Gate) The com suon nuong, or grilled pork chop, was less fatty and juicy than I usually like in my pig, though when plopped atop a mound of rice and drenched in fish sauce, it made for a satisfying meal. A runny fried egg also helped. Com suon nuong, $20. (Scott Lynch / Hell Gate) There's no beer or liquor available yet, which is a tough way to run a restaurant in this part of town, but Maneesilasan is hopeful that the liquor license gods will smile upon him soon. In the meantime, you can get an avocado smoothie or a peanut butter-infused coffee and bop along to quirky covers of pop-radio songs beneath the impressively expansive and goofily lit cotton-puff cloud hovering over the main dining room. (Scott Lynch / Hell Gate) ""We had been looking for a location for months,"" Maneesilasan said. ""And the first moment we walked in here, we were like, oh, this is the place. We are immigrants, and travel around the world like clouds. We're excited to be here and get to know this neighborhood."" Cloud is located at 79 Clinton Street, between Delancey and Rivington Streets, and is currently open from noon to 10 p.m. daily (646-398-9911) . (Scott Lynch / Hell Gate) Already a user? Log in Thanks for reading! Give us your email address to keep reading two more articles for free Email Register See all subscription options",,,,
